{
  "_source": "data/raw/threadmark_index/threadmarks_p*.mht",
  "_count": 194,
  "_note": "words_approx is derived from the forum-rounded display ('5k', '8.2k'), not exact counts.",
  "chapters": [
    {
      "chapter_num": "1",
      "sort_key": [
        1,
        0
      ],
      "title": "Introduction",
      "full_title": "1 Introduction",
      "post_id": 16406074,
      "post_url": "https://forums.sufficientvelocity.com/threads/brocktons-celestial-forge-worm-jumpchain.70036/#post-16406074",
      "publish_ts": 1595207232,
      "publish_iso": "2020-07-19T21:07:12-0400",
      "words_text": "5k",
      "words_approx": 5000,
      "likes": 887,
      "author": "LordRoustabout",
      "source_file": "threadmarks_p1.mht"
    },
    {
      "chapter_num": "2",
      "sort_key": [
        2,
        0
      ],
      "title": "Preparation",
      "full_title": "2 Preparation",
      "post_id": 16406104,
      "post_url": "https://forums.sufficientvelocity.com/threads/brocktons-celestial-forge-worm-jumpchain.70036/#post-16406104",
      "publish_ts": 1595207399,
      "publish_iso": "2020-07-19T21:09:59-0400",
      "words_text": "8.2k",
      "words_approx": 8200,
      "likes": 798,
      "author": "LordRoustabout",
      "source_file": "threadmarks_p1.mht"
    },
    {
      "chapter_num": "3",
      "sort_key": [
        3,
        0
      ],
      "title": "First Fight",
      "full_title": "3 First Fight",
      "post_id": 16406140,
      "post_url": "https://forums.sufficientvelocity.com/threads/brocktons-celestial-forge-worm-jumpchain.70036/#post-16406140",
      "publish_ts": 1595207538,
      "publish_iso": "2020-07-19T21:12:18-0400",
      "words_text": "6.4k",
      "words_approx": 6400,
      "likes": 808,
      "author": "LordRoustabout",
      "source_file": "threadmarks_p1.mht"
    },
    {
      "chapter_num": "3.1",
      "sort_key": [
        3,
        1
      ],
      "title": "Interlude: Brian",
      "full_title": "3.1 Interlude: Brian",
      "post_id": 16411744,
      "post_url": "https://forums.sufficientvelocity.com/threads/brocktons-celestial-forge-worm-jumpchain.70036/#post-16411744",
      "publish_ts": 1595244973,
      "publish_iso": "2020-07-20T07:36:13-0400",
      "words_text": "3.4k",
      "words_approx": 3400,
      "likes": 744,
      "author": "LordRoustabout",
      "source_file": "threadmarks_p1.mht"
    },
    {
      "chapter_num": "4",
      "sort_key": [
        4,
        0
      ],
      "title": "Recovery",
      "full_title": "4 Recovery",
      "post_id": 16417090,
      "post_url": "https://forums.sufficientvelocity.com/threads/brocktons-celestial-forge-worm-jumpchain.70036/#post-16417090",
      "publish_ts": 1595275542,
      "publish_iso": "2020-07-20T16:05:42-0400",
      "words_text": "10k",
      "words_approx": 10000,
      "likes": 761,
      "author": "LordRoustabout",
      "source_file": "threadmarks_p1.mht"
    },
    {
      "chapter_num": "5",
      "sort_key": [
        5,
        0
      ],
      "title": "Negotiation",
      "full_title": "5 Negotiation",
      "post_id": 16427059,
      "post_url": "https://forums.sufficientvelocity.com/threads/brocktons-celestial-forge-worm-jumpchain.70036/#post-16427059",
      "publish_ts": 1595330613,
      "publish_iso": "2020-07-21T07:23:33-0400",
      "words_text": "5.6k",
      "words_approx": 5600,
      "likes": 763,
      "author": "LordRoustabout",
      "source_file": "threadmarks_p1.mht"
    },
    {
      "chapter_num": "6",
      "sort_key": [
        6,
        0
      ],
      "title": "Commission",
      "full_title": "6 Commission",
      "post_id": 16432594,
      "post_url": "https://forums.sufficientvelocity.com/threads/brocktons-celestial-forge-worm-jumpchain.70036/#post-16432594",
      "publish_ts": 1595361286,
      "publish_iso": "2020-07-21T15:54:46-0400",
      "words_text": "9.5k",
      "words_approx": 9500,
      "likes": 748,
      "author": "LordRoustabout",
      "source_file": "threadmarks_p1.mht"
    },
    {
      "chapter_num": "6.1",
      "sort_key": [
        6,
        1
      ],
      "title": "Interlude: Taylor",
      "full_title": "6.1 Interlude: Taylor",
      "post_id": 16443400,
      "post_url": "https://forums.sufficientvelocity.com/threads/brocktons-celestial-forge-worm-jumpchain.70036/page-2#post-16443400",
      "publish_ts": 1595416640,
      "publish_iso": "2020-07-22T07:17:20-0400",
      "words_text": "3.8k",
      "words_approx": 3800,
      "likes": 803,
      "author": "LordRoustabout",
      "source_file": "threadmarks_p1.mht"
    },
    {
      "chapter_num": "7",
      "sort_key": [
        7,
        0
      ],
      "title": "Accessory",
      "full_title": "7 Accessory",
      "post_id": 16449388,
      "post_url": "https://forums.sufficientvelocity.com/threads/brocktons-celestial-forge-worm-jumpchain.70036/page-2#post-16449388",
      "publish_ts": 1595449416,
      "publish_iso": "2020-07-22T16:23:36-0400",
      "words_text": "7.6k",
      "words_approx": 7600,
      "likes": 813,
      "author": "LordRoustabout",
      "source_file": "threadmarks_p1.mht"
    },
    {
      "chapter_num": "8",
      "sort_key": [
        8,
        0
      ],
      "title": "Aftermath",
      "full_title": "8 Aftermath",
      "post_id": 16459462,
      "post_url": "https://forums.sufficientvelocity.com/threads/brocktons-celestial-forge-worm-jumpchain.70036/page-2#post-16459462",
      "publish_ts": 1595505185,
      "publish_iso": "2020-07-23T07:53:05-0400",
      "words_text": "9.8k",
      "words_approx": 9800,
      "likes": 787,
      "author": "LordRoustabout",
      "source_file": "threadmarks_p1.mht"
    },
    {
      "chapter_num": "8.1",
      "sort_key": [
        8,
        1
      ],
      "title": "Interlude: Amy",
      "full_title": "8.1 Interlude: Amy",
      "post_id": 16465066,
      "post_url": "https://forums.sufficientvelocity.com/threads/brocktons-celestial-forge-worm-jumpchain.70036/page-2#post-16465066",
      "publish_ts": 1595534737,
      "publish_iso": "2020-07-23T16:05:37-0400",
      "words_text": "10k",
      "words_approx": 10000,
      "likes": 908,
      "author": "LordRoustabout",
      "source_file": "threadmarks_p1.mht"
    },
    {
      "chapter_num": "9",
      "sort_key": [
        9,
        0
      ],
      "title": "Acquisitions",
      "full_title": "9 Acquisitions",
      "post_id": 16475260,
      "post_url": "https://forums.sufficientvelocity.com/threads/brocktons-celestial-forge-worm-jumpchain.70036/page-2#post-16475260",
      "publish_ts": 1595589490,
      "publish_iso": "2020-07-24T07:18:10-0400",
      "words_text": "9.6k",
      "words_approx": 9600,
      "likes": 767,
      "author": "LordRoustabout",
      "source_file": "threadmarks_p1.mht"
    },
    {
      "chapter_num": "10",
      "sort_key": [
        10,
        0
      ],
      "title": "Overhaul",
      "full_title": "10 Overhaul",
      "post_id": 16480891,
      "post_url": "https://forums.sufficientvelocity.com/threads/brocktons-celestial-forge-worm-jumpchain.70036/page-3#post-16480891",
      "publish_ts": 1595621181,
      "publish_iso": "2020-07-24T16:06:21-0400",
      "words_text": "9.1k",
      "words_approx": 9100,
      "likes": 758,
      "author": "LordRoustabout",
      "source_file": "threadmarks_p1.mht"
    },
    {
      "chapter_num": "11",
      "sort_key": [
        11,
        0
      ],
      "title": "Power Trip",
      "full_title": "11 Power Trip",
      "post_id": 16492318,
      "post_url": "https://forums.sufficientvelocity.com/threads/brocktons-celestial-forge-worm-jumpchain.70036/page-3#post-16492318",
      "publish_ts": 1595686576,
      "publish_iso": "2020-07-25T10:16:16-0400",
      "words_text": "10k",
      "words_approx": 10000,
      "likes": 730,
      "author": "LordRoustabout",
      "source_file": "threadmarks_p1.mht"
    },
    {
      "chapter_num": "12",
      "sort_key": [
        12,
        0
      ],
      "title": "Conference",
      "full_title": "12 Conference",
      "post_id": 16497757,
      "post_url": "https://forums.sufficientvelocity.com/threads/brocktons-celestial-forge-worm-jumpchain.70036/page-3#post-16497757",
      "publish_ts": 1595713970,
      "publish_iso": "2020-07-25T17:52:50-0400",
      "words_text": "8.9k",
      "words_approx": 8900,
      "likes": 750,
      "author": "LordRoustabout",
      "source_file": "threadmarks_p1.mht"
    },
    {
      "chapter_num": "12.1",
      "sort_key": [
        12,
        1
      ],
      "title": "Interlude: Thomas",
      "full_title": "12.1 Interlude: Thomas",
      "post_id": 16505746,
      "post_url": "https://forums.sufficientvelocity.com/threads/brocktons-celestial-forge-worm-jumpchain.70036/page-3#post-16505746",
      "publish_ts": 1595771922,
      "publish_iso": "2020-07-26T09:58:42-0400",
      "words_text": "6k",
      "words_approx": 6000,
      "likes": 755,
      "author": "LordRoustabout",
      "source_file": "threadmarks_p1.mht"
    },
    {
      "chapter_num": "13",
      "sort_key": [
        13,
        0
      ],
      "title": "Exposure",
      "full_title": "13 Exposure",
      "post_id": 16511230,
      "post_url": "https://forums.sufficientvelocity.com/threads/brocktons-celestial-forge-worm-jumpchain.70036/page-3#post-16511230",
      "publish_ts": 1595802089,
      "publish_iso": "2020-07-26T18:21:29-0400",
      "words_text": "11k",
      "words_approx": 11000,
      "likes": 715,
      "author": "LordRoustabout",
      "source_file": "threadmarks_p1.mht"
    },
    {
      "chapter_num": "14",
      "sort_key": [
        14,
        0
      ],
      "title": "Debut",
      "full_title": "14 Debut",
      "post_id": 16521604,
      "post_url": "https://forums.sufficientvelocity.com/threads/brocktons-celestial-forge-worm-jumpchain.70036/page-4#post-16521604",
      "publish_ts": 1595849530,
      "publish_iso": "2020-07-27T07:32:10-0400",
      "words_text": "12k",